{
  "checkpoint_id": "bulk-silicon-convergence-ieee-nontrapping-observable-comparator-execution",
  "task_id": "bulk-silicon.production-reference.convergence.direct-results-disposition",
  "episode_id": "bulk-silicon-convergence-direct-results",
  "status": "pending",
  "decision_class": "genuine_human_decision",
  "created_at": "2026-09-21T01:40:18Z",
  "question": "The divide-by-zero-only run reproduced the exact OpenBLAS trap and classified the matching first later exception, but its mathematical and observable impact remains unknown and the retained normal run reports additional invalid, overflow, and underflow flags. May one release-like, non-trapping MPI/OpenBLAS C48 comparator complete and be compared with the exact retained Apple-Accelerate C48 output?",
  "options": [
    {
      "id": "authorize_one_nontrapping_openblas_c48_observable_comparator",
      "summary": "Recommended: build one isolated release-like MPI/OpenBLAS QE 7.2 executable with no explicit floating-point trap and no warning suppression, run the exact C48 input once with hwloc OpenCL discovery disabled, and report direct observable differences from the retained production C48 output without defining an acceptance tolerance after seeing the result.",
      "consequence": "Use unchanged QE 7.2 source to create only ~/projects/q-e-diagnostics/qe-7.2-openblas-mpi-nontrapping-20260921T014018Z/build. Configure CMake Release with mpicc/mpif90, MPI on, OpenMP off, ScaLAPACK off, external FFTW, pinned OpenBLAS 0.3.33 (SHA-256 dbd757cdfffbff1dc72fbf34983e89d5710933d04783f950441a57522fbf769d), no Apple Accelerate linkage, no explicit -ffpe-trap, and no -ffpe-summary suppression. Build only qe_pw_exe with at most eight local jobs. Stage the exact C48 input and Si.upf under ~/projects/ksdft2effmass-runs/bulk-silicon-ieee-openblas-nontrapping-20260921T014018Z and invoke pw.x exactly once with HWLOC_COMPONENTS=-opencl, OMP_NUM_THREADS=1, one singleton MPI process, and a ten-minute wall limit. Allow up to 30 minutes, 8 GiB memory, and 4 GiB storage for the build; observe 500 MB resident memory and a 250 MB run-workspace envelope. Retain identities, linkage, streams, timing, completion status, emitted IEEE summary, and compact extracted total energy, energy components, pressure, stress tensor, iteration count, and final SCF accuracy. Compare directly with retained C48 stdout SHA-256 994c555388403256752b68b9f320dcf7ffb9917e7dcb7cb6e93d9a06153f65df and time/stderr SHA-256 f510f144d1cfd4823e5240cadabd029ee0925ac506b43ccd349a94ba347bb103, reporting differences without retroactive pass/fail criteria. Stop without retry, warning suppression, class-separated or underflow trap, production dependency adoption, setting promotion, successor activation, or network, remote, cluster, or cloud use. Agreement would be bounded numerical comparison evidence for C48 only, not proof of harmlessness or a production dependency decision."
    },
    {
      "id": "retain_block_without_nontrapping_observable_comparator",
      "summary": "Do not run a non-trapping observable comparator and retain the current block.",
      "consequence": "No further protected execution occurs. The divide-by-zero source remains classified, but its mathematical and observable impact and the origins of the remaining retained flags stay unresolved, so provisional settings cannot be promoted."
    }
  ],
  "recommendation": "authorize_one_nontrapping_openblas_c48_observable_comparator, because source localization and exception classification are now sufficient to replace further trapping runs with one bounded observable-sensitivity test; using the same QE source, input, pseudopotential, compiler family, MPI cardinality, and release optimization while changing the BLAS/LAPACK provider is the narrowest available comparison against the exact retained C48 output.",
  "blocked_scope": "The proposed release-like OpenBLAS build and C48 invocation, any additional flag-origin diagnosis or underflow trapping, warning acceptance or harmlessness disposition, OpenBLAS production adoption, completion of the direct-results disposition, downstream eligibility, lattice-reference activation, production SCF, and automatic successor activation.",
  "safe_scope": "Read-only inspection and deterministic record validation. No build, scientific executable, trap or warning variation, dependency change, retry, successor, network transfer, or remote resource is authorized while this checkpoint is pending.",
  "authoritative_files": [
    "AGENTS.md",
    ".pi/checkpoints/bulk-silicon-convergence-ieee-class-separated-execution.json",
    "calculations/bulk-silicon/production-convergence-preflight/ieee-warning-class-separated-nonmpi-c48-classification.md",
    "calculations/bulk-silicon/production-convergence-preflight/ieee-warning-openblas-nonmpi-c48-comparator.md",
    "calculations/bulk-silicon/production-convergence-preflight/inputs/cutoff/C48.scf.in",
    "tasks/research/bulk-silicon.production-reference.convergence.direct-results-disposition.json"
  ],
  "human_response": null,
  "normalized_decision": null,
  "resolved_at": null,
  "authorized_scope": null,
  "record_paths": [],
  "resumption_status": "blocked_pending_nontrapping_observable_comparator_decision"
}
