{
  "checkpoint_id": "RM-IMPURITY-DEFECT-2D-STAGE-B-TWIST-GAUGE-HC04",
  "task_id": "research-monograph.exercises.impurity.defect-2d",
  "episode_id": "research-monograph-impurity-defect-2d-stage-b-twist-gauge",
  "status": "resolved",
  "decision_class": "genuine_human_decision",
  "created_at": "2026-09-18T19:23:24Z",
  "question": "Which finite-matrix twist-gauge convention should replace the incompatible combination of [0,1) twist reduction, bare site-permutation D4 covariance, and the generic twist (0.37,-0.23) in the accepted Stage B design?",
  "options": [
    {
      "id": "CENTERED_REPRESENTATIVE_UNIFORM_GAUGE",
      "summary": "Use the centred twist representative and a uniform-link gauge.",
      "consequence": "Represent twists in [-1/2,1/2), so every D4 image of the frozen generic twist remains in the same centred domain; construct the finite Hamiltonian in the uniform-link gauge and retain the bare permutation U_M in the covariance equations. The prior [0,1) reduction requirement is replaced."
    },
    {
      "id": "REDUCED_REPRESENTATIVE_GAUGE_DECORATED_UNITARY",
      "summary": "Keep [0,1) twist reduction and use a twist-dependent covariance unitary.",
      "consequence": "Use a periodic seam-compatible finite representation and replace bare full-Hamiltonian covariance by a gauge-decorated symmetry W_M(phi); retain the bare permutation only for the twist-independent onsite defect. The verifier must independently reconstruct W_M(phi)."
    },
    {
      "id": "REDUCED_METADATA_WITH_EXPLICIT_LIFT",
      "summary": "Retain reduced metadata plus an explicit unreduced twist lift.",
      "consequence": "Construct and compare matrices in a uniform-link gauge using the unreduced lift M*phi, retain M*phi modulo one as boundary-fibre metadata, and record the integer lift and its gauge relation explicitly. Bare-permutation covariance applies only to lifted matrices."
    },
    {
      "id": "STOP_STAGE_B",
      "summary": "Do not revise or implement Stage B.",
      "consequence": "Retain the design-level incompatibility and partial execution-free implementation as a negative development finding; no Stage B execution request is made."
    },
    {
      "id": "ADOPT_MULTIROUTE_DATA_COMPLETE_EXECUTION_FREE_IMPLEMENTATION",
      "summary": "Adopt two independent matrix routes, one explicit gauge bridge, both route orders, and data-complete retention; authorize execution-free implementation only.",
      "consequence": "Replace the incompatible single-route convention with the reviewed centered-uniform and reduced-seam constructors, explicit lift/gauge bridge, A-then-B and B-then-A schedules, complete route/candidate/adverse/order retention, runner, independent verifier, schemas, plotting, and authored toy behavioral tests. Accepted-parent execution remains unauthorized."
    }
  ],
  "recommendation": "ADOPT_MULTIROUTE_DATA_COMPLETE_EXECUTION_FREE_IMPLEMENTATION. It preserves the most route, gauge, order, ambiguity, adverse-control, and provenance information for later data-based evaluation while retaining route disagreement and order sensitivity as failures rather than selecting a favorable result.",
  "safe_scope": "Adopt and implement the exact execution-free multi-route design: runner, independent verifier, data-complete schemas, deterministic plotting from retained toy/result records, and authored toy behavioral tests. Do not read or execute the accepted scalar parent and do not create stage-b-result.json.",
  "blocked_scope": "Stage B execution with the accepted parent, creation or interpretation of an accepted-parent Stage B result, Stage C through E, prerequisite reruns, DFT, Wannier90, materials, scientific validation, uncertainty quantification, publication, release, deposit, and external transmission remain unauthorized.",
  "authoritative_files": [
    "AGENTS.md",
    "calculations/research-monograph/impurity-defect-2d/stage-b-implementation-blocker.md",
    "calculations/research-monograph/impurity-defect-2d/stage-b-multiroute-adversarial-review.md",
    "calculations/research-monograph/impurity-defect-2d/stage-b-multiroute-design.json",
    "calculations/research-monograph/impurity-defect-2d/stage-b-multiroute-preflight.md",
    "calculations/research-monograph/impurity-defect-2d/stage-b-multiroute-protocol.md",
    "tasks/research/research-monograph.exercises.impurity.defect-2d.json"
  ],
  "human_response": "recommendation authorized",
  "normalized_decision": "ADOPT_MULTIROUTE_DATA_COMPLETE_EXECUTION_FREE_IMPLEMENTATION",
  "resolved_at": "2026-09-19T01:05:55Z",
  "authorized_scope": "Adopt the exact proposed two-route, one-bridge, two-schedule data-complete Stage B replacement and implement only its fail-closed runner, independent verifier, closed retained-data schemas, deterministic plotting from retained records, and authored toy-coefficient behavioral tests. Preserve all route-local, cross-route, cross-schedule, blind-candidate, adverse-control, stop, resource, and provenance data within the declared bounds. Do not read or execute the accepted scalar parent and do not create an accepted-parent Stage B result.",
  "record_paths": [
    ".pi/checkpoints/research-monograph-impurity-defect-2d-stage-b-twist-gauge.json",
    "calculations/research-monograph/impurity-defect-2d/run_stage_b.py",
    "calculations/research-monograph/impurity-defect-2d/verify_stage_b.py",
    "calculations/research-monograph/impurity-defect-2d/plot_stage_b.py",
    "calculations/research-monograph/impurity-defect-2d/stage-b-implementation-review.md",
    "calculations/research-monograph/impurity-defect-2d/stage-b-multiroute-adversarial-review.md",
    "calculations/research-monograph/impurity-defect-2d/stage-b-multiroute-design.json",
    "calculations/research-monograph/impurity-defect-2d/stage-b-multiroute-preflight.md",
    "calculations/research-monograph/impurity-defect-2d/stage-b-multiroute-protocol.md",
    "python/tests/software_verification/ksdft2effmass/research_monograph/impurity_defect_2d/test__stage_b_execution_contract.py"
  ],
  "resumption_status": "multiroute_data_complete_execution_free_implementation_authorized; accepted_parent_stage_b_execution_unauthorized; automatic_successor_activation_false"
}
