{
  "checkpoint_id": "RM-PERIODIC-2D-OPTIMIZER-BASIN-EXECUTION-HC07",
  "task_id": "research-monograph.exercises.periodic-2d",
  "episode_id": "research-monograph-periodic-2d-optimizer-basin-execution",
  "status": "resolved",
  "decision_class": "genuine_human_decision",
  "created_at": "2026-09-18T10:59:25Z",
  "question": "Authorize the exact bounded local non-DFT Wannier90 optimizer-basin and convergence follow-up described in calculations/research-monograph/periodic-2d-optimizer-basin/study-input.json and preflight.md: nine configurations, eight deterministic smooth periodic U(3) initial gauges per configuration, 72 serial localizations, no retries or discarded failures, a two-hour total cap, 512 MiB per-stage memory cap, and 400 MiB total external-output cap?",
  "options": [
    {
      "id": "AUTHORIZE_EXACT_BOUNDED_STUDY",
      "summary": "Authorize only the declared local non-DFT 72-localization study and its retained evidence.",
      "consequence": "Execute the declared study serially within all resource and stopping bounds; retain every outcome and produce only synthetic optimizer-basin and convergence evidence."
    },
    {
      "id": "DO_NOT_AUTHORIZE",
      "summary": "Do not execute the proposed Wannier90 follow-up.",
      "consequence": "Retain the accepted periodic-2D closure unchanged and perform no new external scientific execution."
    }
  ],
  "recommendation": "AUTHORIZE_EXACT_BOUNDED_STUDY, because the declared deterministic multi-start design directly tests the retained optimizer-basin ambiguity and the predeclared best-and-median finest-pair methodology is stronger than the completed one-axis single-start study while remaining local, synthetic, non-DFT, bounded, and fully negative-result preserving.",
  "safe_scope": "The accepted periodic-2D controlled exercise remains closed. Before execution, retain the exact input, gauge definitions, executable identity, resource bounds, output root, stopping policy, and claim boundary. Execute serially and retain every success, failure, timeout, and basin without automatic retry or favorable-case selection.",
  "blocked_scope": "Without explicit authorization, all Wannier90 execution is blocked. In every case, DFT, material calculations, production Wannierization, remote or cluster execution, dependency changes, publication, release, external transmission, alteration of accepted periodic-2D evidence, scientific validation, uncertainty quantification, and claims of general optimizer or localization convergence remain blocked.",
  "human_response": "yes",
  "normalized_decision": "AUTHORIZE_EXACT_BOUNDED_STUDY",
  "resolved_at": "2026-09-18T10:59:25Z",
  "authorized_scope": "Execute exactly nine declared synthetic configurations and eight declared deterministic smooth periodic U(3) initial gauges per configuration as 72 serial local Wannier90 3.1.0 localizations, subject to the retained two-hour total, 512 MiB per-stage memory, 400 MiB total external-output, no-retry, and stop-on-exceeded-bound policies; extract, independently verify, plot, and document only the resulting non-DFT optimizer-basin and numerical-convergence evidence.",
  "authoritative_files": [
    "AGENTS.md",
    "calculations/research-monograph/periodic-2d-optimizer-basin/study-input.json",
    "calculations/research-monograph/periodic-2d-optimizer-basin/preflight.md",
    "calculations/research-monograph/periodic-2d-optimizer-basin/protocol.md",
    "calculations/research-monograph/periodic-2d/composite-input.json",
    "tasks/research/research-monograph.exercises.periodic-2d.json"
  ],
  "record_paths": [
    ".pi/checkpoints/research-monograph-periodic-2d-optimizer-basin-execution.json",
    "calculations/research-monograph/periodic-2d-optimizer-basin/study-input.json",
    "calculations/research-monograph/periodic-2d-optimizer-basin/preflight.md",
    "calculations/research-monograph/periodic-2d-optimizer-basin/execution-result.json",
    "calculations/research-monograph/periodic-2d-optimizer-basin/result.json",
    "calculations/research-monograph/periodic-2d-optimizer-basin/summary.png",
    "calculations/research-monograph/periodic-2d-optimizer-basin/report.md",
    "calculations/research-monograph/periodic-2d-optimizer-basin/README.md",
    "calculations/research-monograph/periodic-2d-optimizer-basin/protocol.md",
    "calculations/research-monograph/periodic-2d-optimizer-basin/native-evidence-archive.json",
    "calculations/research-monograph/periodic-2d-optimizer-basin/SHA256SUMS"
  ],
  "resumption_status": "exact_bounded_local_execution_authorized; accepted_periodic_2d_task_remains_closed; no_successor_active"
}
