{
  "checkpoint_id": "harness.simplification.docs-json.task-model-contract.clarified-final-acceptance",
  "task_id": "harness.simplification.docs-json.task-model-contract",
  "episode_id": "harness.simplification.docs-json.task-model-contract",
  "status": "pending",
  "decision_class": "genuine_human_decision",
  "created_at": "2026-08-09T17:22:55Z",
  "question": "After applying only the four requested contract-text clarifications while preserving all six mappings, 16 HarnessTask fields, 19 interfaces, 20 diagrams, prior review corrections, and the accepted separate version-1 legacy limitation, should the clarified Stage-1 contract be accepted as the fixed input to later Stage-2 implementation?",
  "options": [
    {
      "id": "A",
      "summary": "Accept the clarified frozen Stage-1 contract.",
      "consequence": "Accept the project-local LocalValidationResult graph boundary, single template_bytes profile representation, byte-structural comparator claim boundary, reuse of the accepted ResourcePath contract, Stage-2 hardening deferrals, complete mappings, 002.002 documentation progression, and all preserved contract decisions. Complete Stage 1 and leave Stage 2 inactive pending separate activation; accept no file migration."
    },
    {
      "id": "B",
      "summary": "Revise the clarified contract again before acceptance.",
      "consequence": "Keep Stage 1 open, record the requested bounded correction, and return for renewed human review without implementation or migration."
    },
    {
      "id": "C",
      "summary": "Defer contract acceptance.",
      "consequence": "Keep the clarified package as proposed evidence, leave Stage 1 incomplete and Stage 2 blocked, and perform no implementation or migration."
    }
  ],
  "recommendation": "Option A. The four requested clarifications are synchronized in the frozen contract and maintained review pages. The source inventory, 118 mappings, 16 HarnessTask fields, 19-interface and 20-diagram counts, six 002.002 destinations, retained review and corrections, and accepted separate version-1 legacy limitation are unchanged. No second independent review or implementation occurred.",
  "blocked_scope": "Human acceptance of the clarified frozen contract; Stage-1 completion; any Stage-2 activation or implementation; exact PIHL.TASK codes or precedence; template parsing or exhaustive validation cases; comparator algorithm hardening; exhaustive schema or ResourcePath rejection fixtures; any migration packet or file disposition; creation of proposed docs targets; drift repair; source replacement; selection-state work; chain cutover; successor activation; dependency, lockfile, SQLite, telemetry, scientific, publication, external, protected, or release work.",
  "safe_scope": "Human review of the maintained review pages, frozen contract, final clarification, inventory, mappings, prior review and corrections, validation record, active Task, and this checkpoint. Deterministic validation and persistence of this pending decision boundary are permitted.",
  "authoritative_files": [
    "AGENTS.md",
    ".pi/tasks/harness.simplification.docs-json.task-model-contract.json",
    ".pi/tasks/harness.simplification.docs-json.task-document-migration.json",
    "docs/harness/ksdft2effmass.harness.002.001.010.md",
    "docs/harness/ksdft2effmass.harness.002.001.011.md",
    ".pi/evidence/docs-json/task-model-contract/source-inventory.json",
    ".pi/evidence/docs-json/task-model-contract/source-mappings.json",
    ".pi/evidence/docs-json/task-model-contract/harness-task-contract.md",
    ".pi/evidence/docs-json/task-model-contract/documentation-destination-correction.md",
    ".pi/evidence/docs-json/task-model-contract/final-contract-clarification.md",
    ".pi/evidence/docs-json/task-model-contract/integration-review.md",
    ".pi/evidence/docs-json/task-model-contract/review-correction.md",
    ".pi/evidence/docs-json/task-model-contract/validation.md",
    ".pi/chains/harness-simplification.chain.json"
  ],
  "human_response": null,
  "normalized_decision": null,
  "resolved_at": null,
  "authorized_scope": null,
  "record_paths": [
    ".pi/chains/harness-simplification.chain.json",
    ".pi/checkpoints/harness.simplification.docs-json.task-model-contract.clarified-final-acceptance.json",
    ".pi/evidence/docs-json/task-model-contract/final-contract-clarification.md",
    ".pi/evidence/docs-json/task-model-contract/harness-task-contract.md",
    ".pi/evidence/docs-json/task-model-contract/validation.md",
    ".pi/tasks/harness.simplification.docs-json.task-model-contract.json",
    "docs/harness/ksdft2effmass.harness.002.001.010.md",
    "docs/harness/ksdft2effmass.harness.002.001.011.md"
  ],
  "resumption_status": "blocked_pending_clarified_contract_acceptance"
}
