{
  "checkpoint_id": "RM-IMPURITY-DEFECT-2D-STAGE-C-ACCEPTED-PARENT-IMPLEMENTATION-ACCEPTANCE-HC14",
  "task_id": "research-monograph.exercises.impurity.defect-2d",
  "episode_id": "research-monograph-impurity-defect-2d-stage-c-accepted-parent-implementation-acceptance",
  "status": "resolved",
  "decision_class": "genuine_human_decision",
  "created_at": "2026-09-19T08:18:31Z",
  "question": "Accept the exact execution-free implementation of the human-adopted accepted-parent Stage C contract and authorize managed administrative closeout of that implementation boundary only?",
  "options": [
    {
      "id": "ACCEPT_EXECUTION_FREE_PARENT_STAGE_C_AND_AUTHORIZE_MANAGED_CLOSEOUT",
      "summary": "Accept the exact authored-fixture parent-contract implementation and close it out.",
      "consequence": "Finalize records and projections, run closeout checks, create one in-scope commit on dev, push it to the configured upstream, verify remote identity, and stop without reading or executing accepted parents or activating Stage D."
    },
    {
      "id": "DO_NOT_ACCEPT_PARENT_STAGE_C_IMPLEMENTATION",
      "summary": "Do not accept the execution-free parent-contract implementation.",
      "consequence": "Retain the current uncommitted implementation and await specific correction or disposition instructions."
    }
  ],
  "recommendation": "ACCEPT_EXECUTION_FREE_PARENT_STAGE_C_AND_AUTHORIZE_MANAGED_CLOSEOUT because the exact adopted contract is implemented with an authored fixture only; all 20 Stage C maintained software-verification tests pass; independent inverse-Fourier, matrix, bridge, and QR reconstruction covers 208 route records and 1,040 fits with maximum scalar difference 1.922e-15 E_G; both anisotropic adverse floors pass; schema, deterministic JSON and SVG, overwrite refusal, resource envelope, Harness, checksum, LuaLaTeX, and visual checks pass; and the adversarial implementation review reports NO_BLOCKING_FINDINGS.",
  "safe_scope": "Accept only the exact HC13 execution-free implementation plan, authored fixture, parent-contract runner, independent verifier, deterministic plotter, closed schema, maintained tests, adversarial implementation review, synchronized documentation, checksums, Task state, and Harness projections; managed closeout may commit and push only this exact in-scope boundary to the configured dev upstream.",
  "blocked_scope": "Accepted periodic, Stage A, or Stage B reads through the new Stage C path; accepted-parent Stage C execution or retained parent result; Stage B reruns; Stages D and E; material-specific DFT; production Wannier90; scientific validation; uncertainty quantification; material transfer; new dependencies; publication; release; deposit; external transmission; and automatic successor activation remain unauthorized.",
  "human_response": "1",
  "normalized_decision": "ACCEPT_EXECUTION_FREE_PARENT_STAGE_C_AND_AUTHORIZE_MANAGED_CLOSEOUT",
  "resolved_at": "2026-09-19T08:49:49Z",
  "authorized_scope": "Accept only the exact HC13 execution-free implementation plan, authored fixture, parent-contract runner, independent verifier, deterministic plotter, closed schema, maintained tests, adversarial implementation review, synchronized documentation, checksums, Task state, and Harness projections; run closeout checks; create one non-amended in-scope commit on the current development branch; push that exact commit to its configured upstream and verify remote identity; stop without reading or executing accepted parents, authorizing an accepted-parent Stage C calculation, or activating Stage D.",
  "authoritative_files": [
    "AGENTS.md",
    ".pi/checkpoints/research-monograph-impurity-defect-2d-stage-c-accepted-parent-design-acceptance.json",
    ".pi/checkpoints/research-monograph-impurity-defect-2d-stage-c-accepted-parent-implementation.json",
    "calculations/research-monograph/impurity-defect-2d/stage-c-accepted-parent-design.json",
    "calculations/research-monograph/impurity-defect-2d/stage-c-accepted-parent-implementation-plan.md",
    "calculations/research-monograph/impurity-defect-2d/stage-c-accepted-parent-implementation-review.md",
    "calculations/research-monograph/impurity-defect-2d/stage-c-accepted-parent-preflight.md",
    "calculations/research-monograph/impurity-defect-2d/stage-c-accepted-parent-protocol.md",
    "calculations/research-monograph/impurity-defect-2d/run_stage_c_parent.py",
    "calculations/research-monograph/impurity-defect-2d/verify_stage_c_parent.py",
    "calculations/research-monograph/impurity-defect-2d/plot_stage_c_parent.py",
    "calculations/research-monograph/impurity-defect-2d/stage-c-result.schema.json",
    "python/tests/software_verification/ksdft2effmass/research_monograph/impurity_defect_2d/resources/stage-c-accepted-parent-authored-fixture.json",
    "python/tests/software_verification/ksdft2effmass/research_monograph/impurity_defect_2d/resources/stage-c-execution-contract-ownership.json",
    "python/tests/software_verification/ksdft2effmass/research_monograph/impurity_defect_2d/test__stage_c_execution_contract.py",
    "tasks/research/research-monograph.exercises.impurity.defect-2d.json"
  ],
  "record_paths": [
    ".pi/checkpoints/research-monograph-impurity-defect-2d-stage-c-accepted-parent-implementation-acceptance.json",
    "calculations/research-monograph/impurity-defect-2d/README.md",
    "calculations/research-monograph/impurity-defect-2d/SHA256SUMS",
    "docs/publications/research-monograph/appendices/J-two-dimensional-defect-extraction.tex",
    "harness/state/harness-control.sql",
    "harness/state/harness-control.sqlite3",
    "harness/state/projection-manifest.json"
  ],
  "resumption_status": "execution_free_parent_stage_c_implementation_human_accepted; managed_closeout_authorized; accepted_parent_reads_and_execution_unauthorized; stages_d_and_e_unauthorized; automatic_successor_activation_false"
}
