{
  "checkpoint_id": "RM-IMPURITY-DEFECT-2D-STAGE-C-ACCEPTED-PARENT-EXECUTION-HC17",
  "task_id": "research-monograph.exercises.impurity.defect-2d",
  "episode_id": "research-monograph-impurity-defect-2d-stage-c-accepted-parent-execution",
  "status": "resolved",
  "decision_class": "genuine_human_decision",
  "created_at": "2026-09-19T11:08:48Z",
  "question": "Authorize exactly one local accepted-parent Stage C protected operation on machine `minerva`, repository `/Users/eugene/worktrees/ksdft2effmass-calculations` at Git revision `9def2718ee763faf2060eb692739600485de5c72`, using native simulation root `/Users/eugene/projects/ksdft2effmass`? If authorized, the operation will exclusively create the append-only attempt journal before hashing or semantically reading the five accepted inputs, thereby consuming the sole attempt; execute the frozen eleven-operation Workflow; exclusively create the result, independent verification log, SVG, report, native evidence manifest, and package checksum catalog; append terminal SUCCESS or FAILURE; retain any partial failure; and permit no retry or overwrite. No pre-attempt aggregate checksum catalog containing an accepted input may be run. The 600-second and 2-GiB values are post-computation observations and rejection checks, not proactive timeout or operating-system memory limits.",
  "options": [
    {
      "id": "AUTHORIZE_ONE_ACCEPTED_PARENT_STAGE_C_EXECUTION",
      "summary": "Authorize one exact local accepted-parent Stage C protected operation with durable attempt consumption and complete retained-package production.",
      "consequence": "After a separate executable authorization record binds the resolved HC17 hash and every frozen identity, one STARTED attempt is consumed before accepted-input hashing; SUCCESS or FAILURE is retained without rerun, replacement, favorable selection, Stage D activation, or any broader authority."
    },
    {
      "id": "DO_NOT_AUTHORIZE_ACCEPTED_PARENT_STAGE_C_EXECUTION",
      "summary": "Keep the accepted-parent Stage C operation unexecuted.",
      "consequence": "No executable authorization record, attempt journal, accepted-parent semantic read, calculation, result package, external-root use, or later-stage activation is permitted."
    }
  ],
  "recommendation": "AUTHORIZE_ONE_ACCEPTED_PARENT_STAGE_C_EXECUTION only if the exact preflight remains satisfied at human resolution. The execution-free adapter, durable attempt consumption, complete package Workflow, exclusive writers, accepted-capable plotter, independent verifier, closed schemas, and authored success/failure/no-retry evidence have no remaining technical blocker. The recommendation explicitly accepts that 600 seconds and 2 GiB are observed and checked only after computation, not proactively enforced hard limits. Resolution-history clarification preserved verbatim: `WRONG WINDOW, HC17`.",
  "safe_scope": "One local Python operation only, with no network, no new dependency, and no external computational executable. Bind implementation identities: accepted-parent design e5103eb95300095d46280fce5539b3e0a168c8c7b41f2f2473d1b3d2d8a48706; runner and protected Workflow 8e9a603d56b685079db8e818e61545fc1275e5ce3b5900823a2c0c86f1472210; verifier 93ceb1e3f3a623b19495e0e18dfeaf8c69c437965e75035366e1d383ea64727b; plotter 21489a1bc9fec08e6c7c2c87d9394b0f69c2e7b520bbda3ce15e3b580730669e; result schema e4a58d8df7825a9231ee3aaf312909ffa78c0ca8225b4b71299466985abc2188; authorization schema 4cd64bb18d8e345b5d5a8589def4da960619848afbbce061a66f97867fcc8b82. Bind already-recorded accepted identities without another preparation read: periodic input 82e9915101e755f7cc77cb8901478f88d878ffaa808732036631b7ae5cfd78ec; periodic result 4eb55bde9d456d86bad1d65c8ac60267c07873c6936f8af876b07fd3e1d27be6; Stage A e6f34cc8a4246b46b963dfef193b07d259427822fa8f280acc5ae4068998d283; Stage B 711c91064e498a183fab9a0ad48f115779bdcb6059e0c23d84270aac75867d9b; execution-free Stage C contract 609c8dd88b27c0ee45870ad67ae525ff2b50832b3fc2d4d8dd770241871a5f15. Exact scale: dimension 64, two fresh schedules, 208 routes, 104 bridges, 1,040 fits, 104 comparisons, ten adverse controls, 225 anisotropic Fourier coefficients, and 61 expected retained compact coefficients. Expected compact package is below 20 MiB; the final authored complete-operation observation was 2,224,320 bytes, 3.88 seconds, and 103,759,872 bytes maximum resident set size, which is synthetic evidence rather than an accepted-parent resource guarantee. Preparation history retains two human-disposed procedural deviations: the parent pre-journal sha256sum byte-read all five accepted inputs, and the worker aggregate SHA256SUMS byte-read Stage A, Stage B, and stage-c-design. Both human responses are preserved verbatim as `recommendation authorized`; neither deviation parsed accepted semantics, performed Stage C computation, authorized execution, consumed the attempt, or added information beyond frozen identities. No further preparation read or hash of any accepted input is permitted. Preparation checks use only an explicit safe-file allowlist excluding all five accepted inputs.",
  "blocked_scope": "Until this checkpoint is explicitly resolved and a separate hash-bound executable authorization record is created, accepted-input hashing, byte reads, parsing, semantic inspection, Stage C execution, attempt-journal creation, result/log/SVG/report/manifest/checksum creation, external-root access or mutation, and verifier or plotter invocation on accepted evidence remain unauthorized. Retry, overwrite, deletion, favorable rerun, tolerance or scientific-setting change, Stage D or E, DFT, production Wannier90, dependency changes, external transmission, publication, release, deposit, commit, push, merge, and automatic successor activation remain outside this checkpoint.",
  "authoritative_files": [
    "AGENTS.md",
    ".pi/checkpoints/research-monograph-impurity-defect-2d-stage-c-accepted-parent-adapter-implementation.json",
    ".pi/checkpoints/research-monograph-impurity-defect-2d-stage-c-native-storage-root.json",
    "calculations/research-monograph/impurity-defect-2d/stage-c-accepted-parent-adapter-implementation-plan.md",
    "calculations/research-monograph/impurity-defect-2d/stage-c-accepted-parent-adapter-implementation-review.md",
    "calculations/research-monograph/impurity-defect-2d/stage-c-accepted-parent-design.json",
    "calculations/research-monograph/impurity-defect-2d/stage-c-accepted-parent-preflight.md",
    "calculations/research-monograph/impurity-defect-2d/stage-c-accepted-parent-protocol.md",
    "calculations/research-monograph/impurity-defect-2d/run_stage_c_parent.py",
    "calculations/research-monograph/impurity-defect-2d/verify_stage_c_parent.py",
    "calculations/research-monograph/impurity-defect-2d/plot_stage_c_parent.py",
    "calculations/research-monograph/impurity-defect-2d/stage-c-result.schema.json",
    "calculations/research-monograph/impurity-defect-2d/stage-c-execution-authorization.schema.json",
    "tasks/research/research-monograph.exercises.impurity.defect-2d.json"
  ],
  "human_response": "yes",
  "normalized_decision": "AUTHORIZE_ONE_ACCEPTED_PARENT_STAGE_C_EXECUTION",
  "resolved_at": "2026-09-19T11:36:43Z",
  "authorized_scope": "Exactly one local protected operation on minerva, repository `/Users/eugene/worktrees/ksdft2effmass-calculations` at revision `9def2718ee763faf2060eb692739600485de5c72`, native root `/Users/eugene/projects/ksdft2effmass`, frozen 12 artifact identities, 11 operations, seven outputs, one consumed attempt with no retry and no overwrite, with the stated post-computation rather than proactive 600-second and 2-GiB checks and the 20-MiB package bound. No Stage D or E activation, settings or tolerance change, commit, push, merge, transmission, or other execution is authorized.",
  "record_paths": [
    ".pi/checkpoints/research-monograph-impurity-defect-2d-stage-c-accepted-parent-execution.json",
    "calculations/research-monograph/impurity-defect-2d/stage-c-accepted-parent-execution-authorization.json",
    "calculations/research-monograph/impurity-defect-2d/stage-c-accepted-parent-attempt.jsonl",
    "calculations/research-monograph/impurity-defect-2d/stage-c-accepted-parent-result.json",
    "calculations/research-monograph/impurity-defect-2d/stage-c-accepted-parent-verification.log",
    "calculations/research-monograph/impurity-defect-2d/stage-c-accepted-parent-summary.svg",
    "calculations/research-monograph/impurity-defect-2d/stage-c-accepted-parent-report.md",
    "calculations/research-monograph/impurity-defect-2d/stage-c-accepted-parent-native-evidence-manifest.json",
    "calculations/research-monograph/impurity-defect-2d/stage-c-accepted-parent-SHA256SUMS"
  ],
  "resumption_status": "resolved_HC17_one_attempt_authorized; executable_authorization_required; attempt_unconsumed; stages_d_and_e_unauthorized; automatic_successor_activation_false"
}
