{
  "checkpoint_id": "RM-IMPURITY-DEFECT-1D-INDEPENDENT-ROUTE-ACCEPTANCE-HC02",
  "task_id": "research-monograph.exercises.impurity.defect-1d.independent-route",
  "episode_id": "research-monograph-impurity-defect-1d-independent-route-correction-acceptance",
  "status": "resolved",
  "decision_class": "genuine_human_decision",
  "created_at": "2026-09-17T23:02:39Z",
  "question": "Do you accept the corrected synthetic independent-route comparison, including the explicit common-space reconciliations, for managed task closeout?",
  "options": [
    {
      "id": "A",
      "summary": "Accept the corrected result and close the task.",
      "consequence": "Accept the seven nominal route comparisons, the retained hopping-truncation noncommutativity, the fail-closed domain, weight, and alignment guards, and their paired common-domain, weighted dual-map/induced-metric, and relative-unitary reconciliation controls as synthetic software and numerical verification under the documented limitations; perform managed administrative closeout including final validation, one in-scope commit, configured-upstream push, and remote-identity verification; do not activate a successor."
    },
    {
      "id": "B",
      "summary": "Do not accept or close the corrected task yet.",
      "consequence": "Keep the task active and request one specific analytical, numerical, editorial, or verification correction without activating a successor or expanding into silicon, external execution, scientific validation, uncertainty quantification, or the analytical-oracle follow-on."
    }
  ],
  "recommendation": "Option A, because the requested stopping-case correction is now constructive without weakening the guards: the 15-cell common-domain route defect is 6.74e-15 E_G; the nonuniform-weight dual-map route defect is 6.82e-15 E_G with the induced-metric self-adjointness defect retained separately; the relative-alignment-map route defect is 1.15e-15 E_G; and the independent verifier reconstructs all three controls without importing the runner. Hopping truncation remains explicitly noncommuting, and no material or continuum claim is made.",
  "blocked_scope": "Human acceptance, managed administrative closeout, commit, push, and successor activation for research-monograph.exercises.impurity.defect-1d.independent-route.",
  "safe_scope": "Read-only inspection, deterministic validation, preservation of retained synthetic artifacts, and reporting without human acceptance, material-validation, continuum-validation, transferability, uncertainty-quantification, or successor-activation claims.",
  "authoritative_files": [
    "AGENTS.md",
    "calculations/research-monograph/impurity-defect-1d-independent-route/protocol.md",
    "calculations/research-monograph/impurity-defect-1d-independent-route/report.md",
    "calculations/research-monograph/impurity-defect-1d-independent-route/result.json",
    "docs/publications/research-monograph/appendices/I-impurity-effective-mass-models.tex",
    "tasks/research/research-monograph.exercises.impurity.defect-1d.independent-route.json"
  ],
  "human_response": "fix mistaches",
  "normalized_decision": "B",
  "resolved_at": "2026-09-17T23:10:31Z",
  "authorized_scope": "Keep the task active and request one specific analytical, numerical, editorial, or verification correction without activating a successor or expanding into silicon, external execution, scientific validation, uncertainty quantification, or the analytical-oracle follow-on.",
  "record_paths": [
    ".pi/checkpoints/research-monograph-impurity-defect-1d-independent-route-correction-acceptance.json",
    "calculations/research-monograph/impurity-defect-1d-independent-route/protocol.md",
    "calculations/research-monograph/impurity-defect-1d-independent-route/report.md",
    "calculations/research-monograph/impurity-defect-1d-independent-route/result.json",
    "docs/publications/research-monograph/appendices/I-impurity-effective-mass-models.tex",
    "tasks/research/research-monograph.exercises.impurity.defect-1d.independent-route.json"
  ],
  "resumption_status": "impurity_defect_1d_independent_route_active_all_mismatch_reconciliation_requested; no_successor_active"
}
