{
  "checkpoint_id": "RM-IMPURITY-DEFECT-2D-STAGE-B-ACCEPTANCE-HC08",
  "task_id": "research-monograph.exercises.impurity.defect-2d",
  "episode_id": "research-monograph-impurity-defect-2d-stage-b-acceptance",
  "status": "resolved",
  "decision_class": "genuine_human_decision",
  "created_at": "2026-09-19T02:44:57Z",
  "question": "Accept the exact HC07 calculated synthetic Stage B multi-route evidence and authorize managed administrative closeout? The retained result has SHA-256 711c91064e498a183fab9a0ad48f115779bdcb6059e0c23d84270aac75867d9b, contains 72 known-map route evaluations, 36 bridge records, and all 2,304 blind candidates, reports no failed runner criterion, and is independently reproduced with reconstruction PASS, criteria PASS, and maximum difference 7.8452687268361823e-13. Gamma and generic blind cases retain the expected unresolved-map counts 512 and 64 per route and schedule; no route or schedule was selected. The two pre-result execution failures and one verifier invocation failure remain retained separately.",
  "options": [
    {
      "id": "ACCEPT_EXACT_STAGE_B_AND_AUTHORIZE_MANAGED_CLOSEOUT",
      "summary": "Accept only the exact bounded Stage B synthetic evidence and authorize its managed administrative closeout.",
      "consequence": "Finalize the manifest, report, manuscript status, task and Harness projections, validate all closeout gates, commit and push exactly the accepted in-scope Stage B boundary to the configured development-branch upstream, verify remote identity, and stop without activating Stage C."
    },
    {
      "id": "DO_NOT_ACCEPT_STAGE_B",
      "summary": "Do not accept the Stage B evidence.",
      "consequence": "Retain the calculated result, independent verification, adverse controls, ambiguity outcomes, and failures as provisional evidence without closeout or successor activation."
    }
  ],
  "recommendation": "ACCEPT_EXACT_STAGE_B_AND_AUTHORIZE_MANAGED_CLOSEOUT because the exact inventory is complete, all runner criteria pass, the independent verifier reconstructs both routes below the frozen tolerance, clean schedules agree exactly, blind ambiguity matches the frozen identifiability prediction without plant-based tie-breaking, adverse controls discriminate the intended failures, resource bounds are satisfied, and every failed invocation remains retained. Acceptance remains limited to bounded synthetic numerical verification.",
  "safe_scope": "Accept only stage-b-result.json and its bound authorization, independent verification, summary plot, manifest, report, retained failure history, implementation tests, documentation, checksum catalog, Task state, and Harness projections. Managed closeout includes one validated non-amended commit and push to the configured upstream development branch with remote identity verification, then stops without activating a successor.",
  "blocked_scope": "Any rerun or further retry; Stage C through E activation or implementation; changed scientific settings; DFT; Wannier90; material transfer; silicon or dopant validation; scientific validation; uncertainty quantification; publication; release; deposit; tag; DOI; external transmission; main-branch action; or unrelated change remains unauthorized.",
  "authoritative_files": [
    "AGENTS.md",
    "calculations/research-monograph/impurity-defect-2d/SHA256SUMS",
    "calculations/research-monograph/impurity-defect-2d/stage-b-native-evidence-final-manifest.json",
    "calculations/research-monograph/impurity-defect-2d/stage-b-native-evidence-manifest.json",
    "calculations/research-monograph/impurity-defect-2d/stage-b-report.md",
    "calculations/research-monograph/impurity-defect-2d/stage-b-result.json",
    "calculations/research-monograph/impurity-defect-2d/stage-b-summary.svg",
    "calculations/research-monograph/impurity-defect-2d/stage-b-verification.log",
    "docs/publications/research-monograph/appendices/J-two-dimensional-defect-extraction.tex",
    "tasks/research/research-monograph.exercises.impurity.defect-2d.json"
  ],
  "human_response": "recommendation authorized",
  "normalized_decision": "ACCEPT_EXACT_STAGE_B_AND_AUTHORIZE_MANAGED_CLOSEOUT",
  "resolved_at": "2026-09-19T02:57:06Z",
  "authorized_scope": "Accept only the exact HC07 bounded Stage B calculated synthetic evidence with result SHA-256 711c91064e498a183fab9a0ad48f115779bdcb6059e0c23d84270aac75867d9b and its retained authorizations, failures, independent verification, plot, manifest, report, tests, documentation, checksum catalog, Task state, and Harness projections; run closeout checks; create one non-amended in-scope commit on the current development branch; push that exact commit to its configured upstream and verify remote identity; stop without activating Stage C or authorizing any rerun.",
  "record_paths": [
    ".pi/checkpoints/research-monograph-impurity-defect-2d-stage-b-acceptance.json",
    "calculations/research-monograph/impurity-defect-2d/README.md",
    "calculations/research-monograph/impurity-defect-2d/SHA256SUMS",
    "calculations/research-monograph/impurity-defect-2d/stage-b-native-evidence-final-manifest.json",
    "calculations/research-monograph/impurity-defect-2d/stage-b-native-evidence-manifest.json",
    "calculations/research-monograph/impurity-defect-2d/stage-b-report.md",
    "docs/publications/research-monograph/appendices/J-two-dimensional-defect-extraction.tex",
    "harness/state/harness-control.sql",
    "harness/state/harness-control.sqlite3",
    "harness/state/projection-manifest.json",
    "tasks/research/research-monograph.exercises.impurity.defect-2d.json"
  ],
  "resumption_status": "exact_stage_b_synthetic_evidence_human_accepted; managed_closeout_authorized; no_rerun; stages_c_through_e_unauthorized; automatic_successor_activation_false"
}
