{
  "checkpoint_id": "P2-HC01",
  "task_id": "P2",
  "episode_id": "backend-neutral-cpn-P2-tools-provenance",
  "status": "resolved",
  "decision_class": "genuine_human_decision",
  "created_at": "2026-08-05T17:31:00Z",
  "question": "Should P2 receive final human acceptance after implementation of the immutable provenance and external-tool lifecycle contract, focused software verification, one consolidated independent review and correction cycle, bounded R1/R2 replay, and final parent verification, with the recorded historical H4 full-suite baseline and final-boundary replay limitation?",
  "options": [
    {
      "id": "A",
      "summary": "Accept P2 as PASS and close P2 only.",
      "consequence": "Record human acceptance of the P2 public software contract and close P2 after deterministic closeout validation. P3 becomes prerequisite-eligible but is not activated. H5, P3-P11, scientific/external execution, publication, and release remain inactive."
    },
    {
      "id": "B",
      "summary": "Request one bounded correction.",
      "consequence": "Keep P2 open and require the human response to identify the exact correction and to authorize any process exception needed beyond the already consumed consolidated correction and replacement replay limits. No successor or execution becomes active."
    },
    {
      "id": "C",
      "summary": "Reject or defer P2.",
      "consequence": "Keep P2 open and inactive at this acceptance boundary. H5, P3-P11, scientific/external execution, publication, and release remain inactive."
    }
  ],
  "recommendation": "Option A, with the recorded limitations. The focused P2 contract, schema/fixtures, class-owned and artifact-owned evidence, Sphinx documentation, package wheel/clean import, affected Ruff/mypy, completion/ownership/checkpoint gates, and maintained local route pass. The full-suite 12 H4 failures and nine full-mypy H2/H4 errors are reproduced starting-revision baselines. R2 is the single permitted replacement replay and remains historical; the final deterministic backslash correction and ancillary status documentation are covered by final checks rather than a prohibited third replay.",
  "blocked_scope": "P2 closure and human acceptance; P3-P11 or H5 activation; scientific or external-tool execution; publication; release.",
  "safe_scope": "Read-only inspection of P2 source, schema, fixtures, tests, documentation, replay records, review records, parent verification, coordination observations, task/chain/checkpoint state, commit, and remote identity. Deterministic checkpoint validation is permitted. No successor launch or protected execution is permitted.",
  "authoritative_files": [
    "AGENTS.md",
    ".pi/tasks/backend-neutral-cpn-P2-tools-provenance.md",
    ".pi/chains/backend-neutral-kohn-sham-qe.chain.json",
    ".pi/evidence/backend-neutral-cpn-P2-tools-provenance/activation.json",
    ".pi/evidence/backend-neutral-cpn-P2-tools-provenance/task-ownership.json",
    ".pi/evidence/backend-neutral-cpn-P2-tools-provenance/review-consolidated.md",
    ".pi/evidence/backend-neutral-cpn-P2-tools-provenance/review-correction-closure.md",
    ".pi/evidence/backend-neutral-cpn-P2-tools-provenance/parent-verification.md",
    ".pi/evidence/backend-neutral-cpn-P2-tools-provenance/replay-inputs-R1.json",
    ".pi/evidence/backend-neutral-cpn-P2-tools-provenance/replay-evidence-R1.json",
    ".pi/evidence/backend-neutral-cpn-P2-tools-provenance/replay-inputs.json",
    ".pi/evidence/backend-neutral-cpn-P2-tools-provenance/replay-evidence.json",
    ".pi/evidence/backend-neutral-cpn-P2-tools-provenance/coordination-observations.json",
    "python/src/ksdft2effmass/provenance/__init__.py",
    "specification/provenance/v1/provenance-v1.schema.json",
    "docs/api/provenance.md",
    "docs/concepts/provenance-and-artifacts.md",
    "docs/user-guide/external-tool-lifecycle.md",
    "docs/verification/provenance-contract.rst"
  ],
  "human_response": "Resolve `P2-HC01` as **Option B** and perform one bounded correction of `records.py` and its directly owned verification surface.",
  "normalized_decision": "B",
  "resolved_at": "2026-08-05T17:52:23Z",
  "authorized_scope": "Keep P2 open and perform exactly one post-R2 bounded correction limited to python/src/ksdft2effmass/provenance/records.py; the seven named class-owned record test modules; directly corresponding specification/provenance/v1 schema and fixtures; directly affected provenance API, concept, and verification documentation; and P2 task, checkpoint, completion, review, ownership, and evidence records. Authorize separate implementation and verification writers, one targeted independent review, at most one small material correction pass, renewed final P2 acceptance checkpoint, and commit/push. R1/R2 remain immutable; no R3/E3, H5, P3-P11, external/scientific execution, publication, or release is authorized.",
  "record_paths": [
    ".pi/checkpoints/P2-HC01-final-acceptance.json",
    ".pi/tasks/backend-neutral-cpn-P2-tools-provenance.md",
    ".pi/chains/backend-neutral-kohn-sham-qe.chain.json",
    ".pi/evidence/backend-neutral-cpn-P2-tools-provenance/P2-HC01-resolution.json",
    ".pi/evidence/backend-neutral-cpn-P2-tools-provenance/task-ownership.json",
    ".pi/evidence/backend-neutral-cpn-P2-tools-provenance/bounded-correction-completion.json",
    ".pi/evidence/backend-neutral-cpn-P2-tools-provenance/bounded-correction-review.md",
    ".pi/evidence/backend-neutral-cpn-P2-tools-provenance/bounded-correction-parent-verification.md",
    ".pi/checkpoints/P2-HC02-final-acceptance.json"
  ],
  "resumption_status": "option_B_bounded_correction_complete_and_validated; P2_open_blocked_at_P2-HC02; no_successor_active"
}
